{
  "type": "risk-acceptance",
  "gaamVersion": "0.9.0",
  "status": "experimental",
  "normativeStatus": "non-normative",
  "riskId": "risk:001",
  "acceptingAuthority": "role:risk-owner",
  "rationale": "Temporary continuity exposure within approved limit.",
  "acceptedAt": "2026-07-29T00:00:00Z",
  "reviewAt": "2026-08-29T00:00:00Z",
  "acceptanceStatus": "accepted"
}
